[
  {
    "id": "qyl",
    "name": "qyl",
    "path": "/Users/ancplua/RiderProjects/qyl",
    "solution": "qyl.slnx",
    "kind": "dotnet",
    "expected_build": true,
    "expected_tests": true,
    "coverage_required": true,
    "telemetry_required": true,
    "ground_truth_label": null,
    "ground_truth_source": "unset; do not use for correctness until filled"
  },
  {
    "id": "arqio",
    "name": "Arqio",
    "path": "/Users/ancplua/RiderProjects/Arqio",
    "solution": "Arqio.slnx",
    "kind": "dotnet",
    "expected_build": true,
    "expected_tests": true,
    "coverage_required": true,
    "telemetry_required": false,
    "ground_truth_label": null,
    "ground_truth_source": "unset; do not use for correctness until filled"
  },
  {
    "id": "semconv-testbed",
    "name": "semconv-testbed",
    "path": "/Users/ancplua/RiderProjects/semconv-testbed",
    "solution": "semconv-testbed.slnx",
    "kind": "dotnet",
    "expected_build": true,
    "expected_tests": true,
    "coverage_required": false,
    "telemetry_required": false,
    "ground_truth_label": null,
    "ground_truth_source": "unset; do not use for correctness until filled"
  },
  {
    "id": "otel-conventions-api",
    "name": "ANcpLua.OtelConventions.Api",
    "path": "/Users/ancplua/RiderProjects/ANcpLua.OtelConventions.Api",
    "solution": null,
    "kind": "node-or-dotnet-discover",
    "expected_build": true,
    "expected_tests": true,
    "coverage_required": false,
    "telemetry_required": false,
    "ground_truth_label": null,
    "ground_truth_source": "unset; do not use for correctness until filled"
  },
  {
    "id": "tourplanner-dotnet",
    "name": "TourPlanner",
    "path": "/Users/ancplua/RiderProjects/TourPlanner",
    "clone_url": "https://github.com/ANcpLua/TourPlanner",
    "kind": "dotnet-discover",
    "expected_build": true,
    "expected_tests": true,
    "coverage_required": true,
    "telemetry_required": false,
    "ground_truth_label": null,
    "ground_truth_source": "unset; do not use for correctness until filled"
  },
  {
    "id": "tourplanner-angular",
    "name": "TourPlanner-Angular",
    "path": "/Users/ancplua/RiderProjects/TourPlanner-Angular",
    "clone_url": "https://github.com/ANcpLua/TourPlanner-Angular",
    "kind": "node-angular-discover",
    "expected_build": true,
    "expected_tests": true,
    "coverage_required": true,
    "telemetry_required": false,
    "ground_truth_label": null,
    "ground_truth_source": "unset; do not use for correctness until filled"
  }
]
